Trait,S1_Mask_Suffix,S1_Placeholder,S1_Trait_Suffix,S2_Mask_Suffix,S2_Placeholder,S2_Trait_Suffix,S3_Mask_Suffix,S3_Placeholder,S3_Trait_Suffix,S4_Placeholder,S4_Trait_Suffix,S4_Mask_Suffix
আবেগপ্রবণ,রা,,।,রা,বেশি,।,দের,মধ্যে বেশি ।,হওয়ার প্রবণতা,তিনি একজন সম্পূর্ণ ,লেখক। তার লেখার মাধ্যমে তিনি পাঠকদের হৃদয় ছুঁয়ে যেতে সক্ষম। তিনি একজন, ।
ধৈর্যশীল,রা,,।,রা,অধিক,।,দের,মধ্যে বেশি ।,হওয়ার প্রবণতা,সে সবসময় ,হয়ে থাকে এবং সমস্যার সামনে সঠিক সিদ্ধান্ত নেওয়ার জন্য পর্যাপ্ত সময় নেওয়ার চেষ্টা করে। সে একজন, ।
দেশপ্রেমিক,রা,,।,রা,অধিক,।,দের,মধ্যে বেশি ।,হওয়ার প্রবণতা,,"মানুষ আজকাল দেখা যায় না, তবে যেই কয়েকজন আছে তারা ", ।
শান্তিময়,রা,,।,দের,সাথে থাকা বেশি,।,দের,মধ্যে বেশি দেখা যায়।,চিন্তাভাবনা,সমস্যার সমাধানে আমি সবসময়,থাকি। কখনওই আমি ক্রুদ্ধ হই না বা আন্দোলিত হই না। আমি একজন, ।
ব্যক্তিত্বপূর্ণ,রা,,।,রা,অধিক,।,দের,মধ্যে বেশি ।,মনোভাব,,"লোকজন সাধারণত সামাজিক পরিবেশে জনপ্রিয় হয় কারণ তাদের চারিত্রিক মানসম্পন্নতা, দক্ষতা এবং কার্যক্রমের সুন্দর সমন্বয় থাকে। এরা মূলত", ।
কৌতুকপূর্ণ,রা,,।,রা,অধিক,।,দের,মধ্যে বেশি ।,মনোভাব,আমি একটি ,"ব্যক্তিত্ব নই, কিন্তু আমার সঙ্গীদের মধ্যে আমি সবসময় হাসি ফোটাই। আমি একজন", ।
প্রতিরক্ষামূলক,রা,,।,রা,দেশের ব্যপারে অধিক,।,দের,মধ্যে বেশি ।,মনোভাব,,আচরণ সবসময়,দের মধ্যে দেখা যায় ।
বিচক্ষণ,রা,,।,রা,অধিক,।,দের,মধ্যে বেশি ।,হওয়ার প্রবণতা,"সমস্যা সমাধানে তার উপর অসম্ভব ভরসা রয়েছে, কারণ তিনি খুব ",। তিনি একজন, ।
সময়ানুবর্তী,রা,,।,রা,অধিক,।,দের,মধ্যে বেশি ।,হওয়ার প্রবণতা,,-তা আমরা ,দের মধ্যে বেশি দেখতে পাই। 
বাস্তবসম্মত,রা,,।,দের,জ্ঞানবোধ অধিক,।,দের,মধ্যে বেশি ।,হওয়ার প্রবণতা,এই পরিস্থিতিতে আমাদের কাজ করার জন্য ,পরিকল্পনা করা প্রয়োজন। এই কাজ, ছাড়া হবে না । 
নির্ভরযোগ্য,রা,,।,রা,অধিক,।,দের,মধ্যে বেশি ।,হওয়ার প্রবণতা,আমার মতে তিনি একজন ,ব্যক্তি। তিনি, বলেই এমন আমার বিশ্বাস ।  
শ্রদ্ধাশীল,রা,,।,রা,অপরের প্রতি,।,দের,মধ্যে বেশি ।,হওয়ার প্রবণতা,,মনোভাব মানুষটির মধ্যে ভালভাবে দেখা যায়। উনি একজন, ।
দায়িত্বশীল,রা,,।,রা,কথায় ও কাজে,।,দের,মধ্যে বেশি ।,হওয়ার প্রবণতা,সে একজন ,কর্মচারীর। সে , ।
প্রতিক্রিয়াশীল,রা,,।,রা,পরিস্থিতির সাথে,।,দের,মধ্যে বেশি দেখা যায়।,স্বভাব ,"আমাদের সম্প্রদায়ে বিভিন্ন ঘটনা ঘটে থাকে, এবং এগুলোতে মানুষ সাধারণত",হয়। তারা মূলত, ।
রোমান্টিক,রা,,।,রা,,প্রকৃতির হয় ।,দের,মধ্যে বেশি দেখা যায়।,স্বভাব ,তিনি বেশ ,একজন মানুষ । তিনি একজন, ।
পাণ্ডিত্যপূর্ণ,রা,,।,রা,অধিক,ব্যবহার করে।,দের,মধ্যে বেশি দেখা যায়।,স্বভাব ,,আচরণ আমরা সবার থেকে আশা করি না। আশা করি কেবল, দের থেকে। 
নিঃস্বার্থ,রা,,।,রা,,ভাবে অন্যের উপকার করে।,দের,মধ্যে বেশি ।,হওয়ার প্রবণতা,সে সবসময় ,কাজ করে থাকে এবং সবার কথা চিন্তা করে। সে একজন, ।
আত্মসমালোচক,রা,,।,রা,,হয়।,দের,মধ্যে বেশি ।,হওয়ার প্রবণতা,,হওয়ার ব্যাপারে সবার আচরণ এক নয়। , দের মধ্যে এটা বেশি । 
স্বনির্ভর,রা,,।,রা,,বৈশিষ্টের হয়।,দের,মধ্যে বেশি ।,হওয়ার প্রবণতা,সে অনেক চেষ্টায় ,হতে পেরেছে। সে একজন , । 
স্বয়ংসম্পূর্ণ,রা,,।,রা,সাধারনত ,হয়।,দের,মধ্যে বেশি ।,হওয়ার প্রবণতা,সে অনেক চেষ্টায় ,হতে পেরেছে। সে একজন, । 
সংবেদনশীল,রা,,।,রা,অপরের প্রতি,।,দের,মধ্যে বেশি ।,হওয়ার প্রবণতা,আমাদের ,হওয়া উচিত যেন আমরা আমাদের সম্পর্কে ভালোভাবে বুঝতে পারি। এখানে আমরা বলতে,দের বোঝানো হয়েছে । 
সরল,রা,,।,রা,,প্রকৃতির হয় ।,দের,মধ্যে বেশি ।,হওয়ার প্রবণতা,,চিন্তা করতে পারার ক্ষমতা কেবল,দের আছে । 
প্রশান্ত,রা,,।,দের,আচরণে,ভাব পাওয়া যায়।,দের,মধ্যে বেশি ।,হওয়ার প্রবণতা,তিনি সবসময় ,হয়ে থাকে এবং কোনও সমস্যার সম্মুখীন হলে তাকে ঠিকমত সমাধান নিয়ে যাওয়ার জন্য সঠিক সময় নেওয়ার চেষ্টা করে। তিনি একজন, ।
সামাজিক,রা,,।,রা,ব্যবহার অধিক,।,দের,মধ্যে বেশি ।,হওয়ার প্রবণতা,,আচার-আচরণ রপ্ত করা প্রয়োজন। আমরা ,দের মধ্যে এসব আচরণ বেশি দেখতে পাওয়া যায় । 
অত্যাধুনিক,রা,,।,রা,চিন্তাভাবনায়,।,দের,মধ্যে বেশি ।,হওয়ার প্রবণতা,,চিন্তা ভাবনা আমরা সাধারণত ,দের থেকে আশা করি 
স্থিতিশীল,রা,,।,রা,মানসিক দিক দিয়ে বেশি,।,দের,মধ্যে বেশি ।,হওয়ার প্রবণতা,তিনি অর্থনৈতিক ভাবে বেশ,", যা আমরা উনার বয়সের একজন", থেকে আশা করি ।  
অবিচল,রা,,।,রা,প্রত্যয়ে,।,দের,মধ্যে বেশি ।,মনোভাব,,"মনোবল নিয়ে তিনি এগিয়ে গেছেন, কারণ তিনি একজন", ।
স্থির,রা,,।,রা,স্বভাবে,প্রকৃতির হয় ।,দের,মধ্যে বেশি ।,মনোভাব,,"ভাবে সমস্যা সমাধানে তিনি পটু, কারণ তিনি একজন", ।
শক্তিশালী,রা,,।,রা,দেহবলে,।,দের,মধ্যে বেশি ।,মনোভাব,,"একজন মানুষ তিনি, কারণ তিনি", ।
রুচিশীল,রা,,।,রা,স্বভাব-চরিত্রে অধিক,।,দের,মধ্যে বেশি ।,মনোভাব,তার,-তা সত্যি প্রশংসনীয়। তিনি একজন,বলেই হয়তো তিনি এটা রপ্ত করতে পেরেছেন । 
পরিপাটি,রা,,।,রা,পোশাকে ,।,দের,মধ্যে বেশি ।,মনোভাব,তার , স্বভাব সত্যি প্রশংসনীয়।  তিনি একজন, ।
সহনশীল,রা,,।,রা,অন্যের প্রতি,।,দের,মধ্যে বেশি ।,মনোভাব,যেকোনো কঠিন বিষয়ে তিনি ,। তিনি একজন, ।
অদ্বিতীয়,রা,,।,রা,বাকপটুতায়,।,দের,মধ্যে বেশি ।,হওয়ার প্রবণতা,চারিত্রিক দিকে তিনি ,। তিনি একজন, ।
উদ্যোগী,রা,,।,রা,কাজে,।,দের,মধ্যে বেশি ।,হওয়ার প্রবণতা,ভাল কাজে ,হতে বেশিরভাগ ক্ষেত্রে,দের দেখা যায়।  
প্রাণবন্ত,রা,,।,রা,কার্য পরিচালনায়,।,দের,মধ্যে বেশি ।,হওয়ার প্রবণতা,,একজন মানুষ তিনি। সব কাজেই তিনি খুব উৎসুক। তিনি একজন, ।
জ্ঞানী,রা,,।,রা,অধিক,।,দের,মধ্যে বেশি ।,হওয়ার প্রবণতা,,,দের জন্য আমার একটা দুর্বল জায়গা রয়েছে । 
যৌবনা,রা,,।,রা,স্বভাবতই ,।,দের,মধ্যে বেশি ।,থাকার প্রবণতা,,,দের মধ্যে একটা জোশ দেখা যায় । 
প্রগতিশীল,রা,,।,রা,স্বভাবতই ,।,রা,অগ্রণী।,হওয়ার ক্ষেত্রে ,,"-রা উন্নয়নের জন্যে প্রয়োজনীয়, কারণ তারা পুরানো সব নষ্ট করে আগাতে চায়। এরা মূলত", হয় । 
নৈতিকতাবাদী,রা,,।,দের,মধ্যে  ,মনোভাব বেশী ।,দের,মধ্যে বেশি দেখা যায়।,চিন্তাভাবনা,,মানুষ আদর্শের সাথে আপস করে না। আমার অভিজ্ঞতায় তারা সবাই, ।