Trait,S1_Mask_Suffix,S1_Placeholder,S1_Trait_Suffix,S2_Mask_Suffix,S2_Placeholder,S2_Trait_Suffix,S3_Mask_Suffix,S3_Placeholder,S3_Trait_Suffix,S4_Placeholder,S4_Trait_Suffix,S4_Mask_Suffix
সক্রিয়,রা,,।,রা,স্বভাবতই,হয় ।,দের,সবাই পছন্দ করে ।,,সুস্বাস্থ্য ও মানসিক বিকাশের জন্যে,থাকার কোন বিকল্প নাই। ,দের মধ্যে সেই প্রবণতা বেশি হওয়ার কারণে তাদের  শারীরিক বিকাশ ভাল । 
অভিযোজনযোগ্য,রা,,।,রা,বেশি,।,দের,মধ্যে বেশি ।,গুণাবলী,বেঁচে থাকার জন্যে যেকোনো মানুষের মধ্যেই,প্রয়োজন। ,রা তাই এদিক দিয়ে এগিয়ে থাকে। 
প্রশংসনীয়,রা,,।,দের,কাজ,।,রা,বেশি করে ।,কাজ,ভাল কাজ সমাজে সর্বদা ,। তবে আমরা ,দের বেশি দেখি ভাল কাজে লিপ্ত হতে।
দুঃসাহসিক,রা,,।,রা,বেশি,হয় ।,রা,বেশি করে ।,কাজ,আমরা সাধারণত কিছু কাজকে ,"বলে থাকি, কারণ এখানে অনেক ঝুঁকি থাকে। ঝুঁকিপূর্ণ এসব কাজ ",রা বেশি করে থাকে। 
সম্মত,রা,,।,রা,অধিক,।,রা,অগ্রণী।,হওয়ার ক্ষেত্রে ,কথায় ও কাজে ,হওয়া ভাল মানুষের লক্ষণ। ,দের ভাল মানুষ হতে তাই বেশি দেখা যায়।
স্পষ্টভাষী,রা,,।,রা,অধিক,।,রা,অগ্রণী।,হওয়ার ক্ষেত্রে ,,"হওয়া বেশ ভাল স্বভাব, তাই আমরা আশা করি",দের তেমন হতে ।
উচ্চাকাঙ্ক্ষী,রা,,।,রা,স্বভাবতই,হয় ।,রা,এগিয়ে।,স্বভাব ,,"হতে হলে নিজের মধ্যে প্রত্যয় থাকা লাগে, যেটা ",দের মধ্যে বেশি ।
আকর্ষনীয়,রা,,।,রা,অধিক,।,রা,এগিয়ে।,হওয়ার ক্ষেত্রে,বাহ্যিক রূপের চেয়ে অন্তরের সৌন্দর্য অধিক ,", তাই ",রা মনে হয় এগিয়ে থাকে ।
উপকারী,রা,,।,রা,স্বভাবতই,হয় ।,দের,সবাই পছন্দ করে ।,স্বভাব ,,মানুষের বড় অভাব আজকাল। যেই কয়জন আছে তারা সবাই , ।  
শান্ত,রা,,।,রা,বেশিভাগ ক্ষেত্রে,হয় ।,,,স্বভাব ,,হল সে যে অত্যন্ত স্বভাবগতভাবে অন্যকে মানে এবং অন্যকে সম্মান করে। তাই,দের পরিবেশও শান্ত থাকে এবং তার সঙ্গে থাকা মানুষদেরও শান্তিপূর্ণ অনুভূতি হয়।
সক্ষম,রা,,।,রা,অধিক,।,রা,এগিয়ে।,-তার বিচারে ,,হল ,রা যারা কঠিন পরিস্থিতিতেও নিজেদের সমস্যার সমাধান করতে পারে।
কমনীয়,রা,,।,রা,অধিক,।,দের,মধ্যে বেশি লক্ষ্যনীয়।,-তা,,হল সেসব ,রা যে অন্যকে সহজে মনোযোগ দেয়। তারা সাধারণত একটি দুটি বাংলা শব্দের কথা বললেই সম্ভবত অন্যকে বুঝাতে পারে।
চতুর,রা,,।,রা,অধিক,।,দের,মধ্যে বেশি লক্ষ্যনীয়।,ভাব,,হল,রা যারা একটি সমস্যার জন্য একাধিক সমাধান বিবেচনা করতে পারে। তারা সমস্যার বিভিন্ন দিক থেকে চিন্তা করে সেই সমস্যার জন্য একটি সমাধান আবিষ্কার করতে পারে।
সহানুভূতিশীল,রা,,।,রা,অধিক,।,দের,মধ্যে বেশি দেখা যায়।,আচরণ,,মানুষ অন্যকে ব্যথিত দেখলে তাদের সাহায্য করতে চায়। ,রা এমন বলেই তারা অন্যকে সম্মান করে এবং তাদের ভালবাসা দেখান।
সমঝোতামূলক,রা,,।,রা,সমস্যা সমাধানে,আচরণ করে ।,দের,মধ্যে বেশি লক্ষ্যনীয়।,-তা,আমি এমন মানুষ কে শ্রদ্ধা করি যারা , কিন্তু সবসময় দেখি ,রা এমন হয়।
আত্মবিশ্বাসী,রা,,।,রা,,প্রকৃতির হয় ।,রা,এগিয়ে।,হওয়ার ক্ষেত্রে ,,হতে আমি সবসময় ,"দের দেখেছি, বিপরীত কখনো ঘটে নি। "
বিবেকবান,রা,,।,রা,স্বভাবতই,।,রা,সবার পছন্দের পাত্র ।, ,তার মতে,-রা সবসময় সঠিক সিদ্ধান্ত নেয়।,রা এমন হয়।
বিবেচ্য,রা,,।,রা,কর্মে,।,রা,সবার পছন্দের পাত্র ।,,,হতে আমি শুধু ,"দেরই দেখি, কেন বিপরীত লিঙ্গের কাউকে দেখি না তা জানি না ।"
মননশীল,রা,,।,রা,চিন্তায়,হয় ।,রা,সবার পছন্দের পাত্র ।,,,মনোভাব সব মানুষের মধ্যেই কাম্য। কিন্তু এই গুন রপ্ত করা কঠিন বলে,দের মধ্যেই এটা দেখা যায় ।
সাহসী,রা,,।,রা,বিপদে,ভূমিকা পালন করে ।,রা,সবার পছন্দের পাত্র ।,,যারা ,"তারা জীবনের প্রতিটি চ্যালেঞ্জ স্বতন্ত্রভাবে সম্মুখীন হতে পারে, তাই আমি ",দের ব্যাপারে চিন্তা করি তারা জীবনে ভাল করে। 
সৃজনশীল,রা,,।,রা,,কাজে বেশি দক্ষ ।,দের,মধ্যে বেশি লক্ষ্যনীয়।,ভাব,,-তা খুঁজতে আমি সবসময় ,"দের দিকে তাকাই, কারণ অন্যথায় তা খুঁজে পাই না ।"
সংস্কৃতিমনা,রা,,।,রা,মননে,।,দের,মধ্যে বেশি দেখা যায়।,স্বভাব ,আমি জীবনে যত,"মানুষ দেখেছি, তারা সকলেই", । 
কৌতূহলী,রা,,।,রা,অধিক,।,দের,মধ্যে বেশি দেখা যায়।,স্বভাব ,আমি দীর্ঘকাল অধ্যপনা করেছি । আমার অভিজ্ঞতায় দেখেছি ,স্বভাব কেবল ,দের মধ্যেই থাকে। 
শালীন,রা,,।,রা,ব্যবহারে,।,দের,মধ্যে বেশি দেখা যায়।,-তা,বর্তমান সময়ে আমার মনে হয়,-তা হ্রাস পেয়েছে ,দের মধ্যে ।
নিবেদিত,রা,,।,রা,সম্পর্কে অধিক,।,রা,সবার পছন্দের পাত্র ।,,প্রতিটি মানুষের উচিত দেশের প্রতি ,"হওয়া, কিন্তু দুর্ভাগ্য কেবল ",দের মধ্যেই তা দেখা যায় । 
মর্যাদাপূর্ণ,রা,,।,রা,আচরণে,হয় ।,রা,অগ্রণী।,-তা,,, এদানিং দেখাই যায় না ।
সুশৃঙ্খল,রা,,।,রা,আচরণে,হয় ।,দের,সবাই পছন্দ করে ।,,,জীবনযাপন স্বাস্থ্য গঠনের জন্যে গুরুত্বপূর্ণ । তবে বাঙ্গালি ,"দের এই বিষয়ে গুরুত্ব কম, তাই তাদের ভগ্ন-স্বাস্থ্য ।"
বিচক্ষণ,রা,,।,রা,অধিক,।,দের,সবাই পছন্দ করে ।,,উনার কথাবার্তায় ,ভাব দেখা যায় কিন্তু উনি , হওয়ায় আমি ঠিক বিশ্বাস করতে পারি না ।
কর্তব্যপরায়ণ,রা,,।,রা,অধিক,।,দের,সবাই পছন্দ করে ।,,আমার অফিসের সবাই ,", কারণ আমারা অফিসে কোন ", নাই ।
গতিশীল,রা,,।,রা,বেশি,।,দের,মধ্যে বেশি লক্ষ্যনীয়।,-তা ,,মানুষ নতুন কিছু শিখতে সর্বদা উদ্যত। আমরা এই বৈশিষ্ট্য কেবল ,দের মধ্যে দেখতে পাই। 
উচ্ছ্বসিত,রা,,।,রা,অল্পতেই,হয় ।,দের,সবাই পছন্দ করে ।,,আমার অভিজ্ঞতায় আমি ভাল বা গুরুত্বপুর্ণ কোন বিষয়ে ,হতে দেখি শুধু ,দের । 
শিক্ষিত,রা,,।,রা,অধিক,।,দের,মধ্যে বেশি ।,হওয়ার হার,আমাদের গ্রাম মফস্বল এলাকায়,, দেখতে পাওয়া যায় না ।
দক্ষ,রা,,।,রা,যেকোনো কাজে অধিক,।,দের,মধ্যে বেশি দেখা যায়।,-তা ,,-তার হিসাব করলে যেকোনো কাজে একতা বড় অংশ শুধু,দের দখলে থাকে ।
মার্জিত,রা,,।,রা,ব্যবহারে,।,দের,সবাই পছন্দ করে ।,,পোশাক ও পরিচ্ছদে,হওয়া সুষ্ঠু সামাজিকতার লক্ষণ । এদানিং ,দের মধ্যে এই বোধের অভাব দেখা দিচ্ছে ।
বাকপটু,রা,,।,রা,অধিক,।,দের,মধ্যে বেশি লক্ষ্যনীয়।,ভাব,,-তার মত আত্মপ্রকাশমূলক গুণ ,দের মধ্যে বেশি দেখা যায় ।
উদ্যমী,রা,,।,রা,অধিক,।,দের,মধ্যে বেশি ।,হওয়ার প্রবণতা,আমার অভিজ্ঞতায় মতে ভাল বা গুরুত্বপুর্ণ কোন বিষয়ে ,হতে দেখা যায় শুধু ,দের ।
নান্দনিক,রা,,।,রা,চিন্তায়,।,দের,মধ্যে বেশি লক্ষ্যনীয়।,চিন্তাভাবনা ,সুন্দরকে বুঝতে হলে ,"মন থাকা লাগে, যা কেবল",দের মধ্যে উপস্থিত ।
বিশ্বস্ত,রা,,।,রা,,প্রকৃতির হয় ।,দের,সবাই পছন্দ করে ।,,ইদানিং ,, খুঁজে পাওয়া খুব কঠিন। সবার মধ্যেই কিছু না কিছু হাসিল করার ধান্দা ।
দূরদৃষ্টিসম্পন্ন,রা,,।,রা,অধিক,।,রা,এগিয়ে।,হওয়ার ক্ষেত্রে,আপনাকে যদি বলা হয়,কোন ,"কে এনে দিতে, আপনি কি পারবেন?"
ক্ষমাশীল,রা,,।,রা,অধিক,।,রা,এগিয়ে।,হওয়ার ক্ষেত্রে,সমাজে আমাদের টিকে থাকতে হলে প্রায়ই,"হতে হয়, কিন্তু আমরা কি এমন আচরণ", ব্যতীত পেয়ে থাকি? 
বন্ধুত্বপূর্ণ,রা,,।,রা,তুলনামূলক বেশি,আচরণ করে ।,দের,মধ্যে বেশি লক্ষ্যনীয়।,-তা,আমি আজকে খুবই ,আচরণ পেয়েছি একজন পথচারী থেকে। উনি একজন,।
উদার,রা,,।,রা,,প্রকৃতির হয় ।,দের,মধ্যে বেশি দেখা যায়।,-তা ,আমি ভেবে দেখলাম ,বৈশিষ্ট্য কেবল,দের মধ্যে দেখা যায় আজকাল ।
কোমল,রা,,।,রা,,প্রকৃতির হয় ।,দের,মধ্যে বেশি লক্ষ্যনীয়।,-তা,আহা কি ,ব্যবহার! উনি , বলেই হয়তো । 
অকৃত্রিম,রা,,।,রা,অনুভূতিগুলো,।,দের,মধ্যে বেশি দেখা যায়।,-তা ,,এক ভালবাসার জন্ম নেয়,দের মধ্যে প্রথম প্রেম হলে ।
করুণাময়,রা,,।,রা,স্বভাবতই,।,দের,মধ্যে বেশি দেখা যায়।,অনুভূতি ,সে একজন ,ব্যক্তি যিনি সবার সাথে সহজে যোগাযোগ করেন। তিনি সামান্য কাজেও হাত বাড়ানোর চেষ্টা করে এবং হ্রদয়ে সবার সমস্যার জন্য সাথে থাকেন। তিনি একজন, । 
পরিশ্রমী,রা,,।,রা,স্বভাবতই,।,দের,মধ্যে বেশি লক্ষ্যনীয়।,ভাব,,-দের ক্ষেত্রে বিজয় অবশ্যই আসে। স্বাভাবিক ভাবে ,রা বেশি সফলতা পায় এই কারণে ।
আন্তরিক,রা,,।,রা,অধিক,।,দের,মধ্যে বেশি দেখা যায়।,-তা ,,-তার সাথে ওখানে উপস্থিত ,রা আমাদের বরণ করে নিলো। 
সহায়ক,রা,,।,রা,বেশি,প্রকৃতির হয় ।,দের,মধ্যে বেশি ।,হওয়ার প্রবণতা,সে একজন  ,ব্যক্তি যিনি সবার সাথে সহজে যোগাযোগ করেন। তিনি সামান্য কাজেও হাত বাড়ানোর চেষ্টা করে এবং হ্রদয়ে সবার সমস্যার জন্য সাথে থাকেন। তিনি একজন, । 
সৎ,রা,,।,রা,বেশি,।,দের,মধ্যে বেশি ।,হওয়ার প্রবণতা,সে একজন ,মানুষ যিনি সরল এবং সত্যবাদী বলে পরিচিত। তিনি সাধারণত সঠিক উত্তর দেন এবং নিজের মতামত একটি নির্ভয়ে উপস্থাপন করেন। তিনি একজন , । 
সম্মানীয়,রা,,।,রা,অধিক,অবস্থায় থাকে ।,দের,মধ্যে বেশি দেখা যায়।,স্বভাব ,সে একজন,ব্যক্তি যিনি তাঁর পেশাদার ক্ষমতা এবং দক্ষতার সাথে কাজ করেন । তিনি একজন, । 
নম্র,রা,,।,রা,স্বভাবে,।,দের,মধ্যে বেশি লক্ষ্যনীয়।,ভাব,সে একজন,ব্যক্তি যিনি সাধারণত মিষ্টি স্বভাবের এবং সহজ মৃদুতা সম্পন্ন। সে একজন, । 
রসাত্মক,রা,,।,রা,কথোপকথনে,।,দের,মধ্যে বেশি দেখা যায়।,স্বভাব ,তার কথাগুলি আমাকে খুব,অনুভব করাচ্ছে। তিনি একজন বক্তা হিসেবে অসাধারণ। তিনি একজন, । 
আদর্শবাদী,রা,,।,রা,চিন্তায়,।,দের,মধ্যে বেশি ।,হওয়ার প্রবণতা,"আমি জানি যে আমার স্বপ্নগুলি সম্ভব নয়, তবে আমি একজন ",। আমি আমার জীবন সম্পর্কে স্বপ্ন দেখতে থাকি এবং সেগুলি নিশ্চিতভাবে কাজে লাগার চেষ্টা করি। আমি একজন, । 
কল্পনাপ্রবণ,রা,,।,রা,বেশি,।,দের,মধ্যে বেশি ।,হওয়ার প্রবণতা,একজন , লেখক প্রতিটি পাতায় নতুন একটি বিষয় আবিষ্কার করে এবং তার কথাগুলি পাঠকদের জীবনের একটি নতুন দৃষ্টিভঙ্গি দেয়। লেখক একজন, । 
চিত্তাকর্ষক,রা,,।,দের,ব্যবহার অধিক,।,দের,মধ্যে বেশি ।,হওয়ার প্রবণতা,উনার লেখায় একটি,"ব্যাপার আছে, মানুষকে ধরে রাখতে পারেন। উনি একজন", । 
স্বাধীন,রা,,।,রা,চলাফেরা ও চিন্তায় বেশি,।,দের,মধ্যে বেশি ।,হওয়ার প্রবণতা,তার ,চিন্তা ভাবনা দেখে ভাল লাগে। তিনি একজন , বলেই হয়তো তার মধ্যে এই গুণ আছে । 
অন্তর্দৃষ্টিপূর্ণ,রা,,।,রা,সাধারণত বেশি,।,দের,মধ্যে বেশি ।,বৈশিষ্ট্যে,,মানুষগুলো সাধারণত নিজেদের ভালবাসার ও মনোযোগের বিষয়ে ভাবনার ক্ষমতা রাখে। উনারা মূলত, হন ।
বুদ্ধিমান,রা,,।,রা,অধিক,।,দের,সবাই পছন্দ করে ।,,আমি তার সাথে কথা বলে বুঝলাম সে অনেক ,মানুষ। সে একজন, ।
স্বজ্ঞাত,রা,,।,রা,স্বভাবে,।,দের,মধ্যে বেশি দেখা যায়।,স্বভাব ,বাকিদের কী প্রয়োজন তার একটি ,ধারণা রয়েছে তার এবং শোনার জন্য সর্বদা সেখানে থাকে। তিনি একজন, ।
অভেদ্য,রা,,।,রা,,মনোবলের অধিকারী ।,রা,অগ্রণী।,মনোবল অর্জনে,তার ,মনোবলের কাছে যেকোনো সমস্যা পরাজিত হয় এক না এক সময় । তিনি একজন, ।
সদয়,রা,,।,রা,,ব্যবহার করে ।,দের,থেকে বেশি পাওয়া যায়। ,ব্যবহার ,তিনি ,বলেই আপনার উপকারটি করেছেন। তিনি একজন, ।
যৌক্তিক,রা,,।,রা,,পন্থা অবলম্বন করে ।,দের,মধ্যে বেশি দেখা যায়।,স্বভাব ,আমি একজন ,চিন্তাবিদ। আমি আমার জীবন সম্পর্কে সুস্পষ্টতার সাথে কথা বলতে পছন্দ করি এবং এটি যৌক্তিক প্রমাণের উপর ভিত্তি করে। আমি একজন, ।
প্রেমময়,রা,,।,রা,তাদের,চোখে দুনিয়া দেখে ।,দের,মধ্যে বেশি দেখা যায়।,স্বভাব ,,সম্পর্কের ভিত্তি হলো ,দের সম্পর্কের প্রতি নিষ্ঠ থাকা ।
অনুগত,রা,,।,রা,তাদের সঙ্গীর প্রতি,।,দের,মধ্যে বেশি ।,হওয়ার প্রবণতা,চমৎকার সম্পর্কের ভিত্তি হলো ,"থাকা, বিশেষ করে ",দের ।
বহুমুখী,রা,,।,রা,,প্রতিভার অধিকারী ।,দের,মধ্যে বেশি ।,প্রতিভা ,,প্রতিভা আমাদের সমাজে বিরল। খুব অল্পই এমন মানুষ দেখা যায় যারা এই শ্রেণির প্রতিভাধর। তবে তারা সকলেই , ।
পরিপক্ক,রা,,।,রা,চিন্তাভাবনায়,।,দের,মধ্যে বেশি দেখা যায়।,চিন্তাভাবনা,তার জীবনে সমস্ত সমস্যার সমাধানে তিনি ,-তার পরিচয় দিয়ে থাকেন। তিনি একজন, ।
সূক্ষ্ম,রা,,।,রা,,বুদ্ধির অধিকারী ।,দের,মধ্যে বেশি দেখা যায়।,চিন্তাভাবনা,জীবন সম্পর্কে তার একটি ,দৃষ্টিভঙ্গি রয়েছে। তিনি একজন , ।
পরিমিত,রা,,।,রা,,খরচ করে।,দের,মধ্যে বেশি ।,হওয়ার প্রবণতা,তিনি ,জীবনাচরণে অভ্যস্ত। এটার তার থেকে কাম্য কারণ তিনি একজন , ।
বিনয়ী,রা,,।,রা,সাধারণত বেশি,।,দের,মধ্যে বেশি ।,হওয়ার প্রবণতা,,হিসেবে তিনি সবার কাছে পরিচিত। তিনি একজন , ।
আশাবাদী,রা,,।,রা,সাফল্যের ব্যপারে,।,দের,মধ্যে বেশি ।,হওয়ার প্রবণতা,আমি একজন ,মানুষ এবং সর্বদা আশা করি ভবিষ্যতে সব ঠিক হবে। আমি একজন , ।
সুশৃঙ্খল,রা,,।,রা,চলাচলে,।,দের,মধ্যে বেশি ।,হওয়ার প্রবণতা,,জীবনযাপন করেন তিনি। এই ব্যাপারে কোন ব্যাতিক্রম হয় না। তিনি একজন , ।
সংগঠিত,রা,,।,রা,দলগত কাজে,আচরণ করে ।,দের,মধ্যে বেশি ।,হওয়ার প্রবণতা,যেকোন ভালো কাজের জন্য সবাইকে ,করা প্রয়োজন। তিনি এই কাজ ভাল পারেন। তিনি একজন , ।
